### ISSUE TITLE
NetworkStream can silently discard written data on Linux

### ISSUE THREAD

**Issue by wfurt** [dotnet/runtime#44764]
I bump to this while investing #44175. The original repro with CopyToAsync_AllDataCopied_Large  was time sensitive and I could never reproduce it with running under debugger or strace. The code bellow is simplification based on my observation and fails for me on my Ubuntu18.04 system:

```c#
using System;
using System.IO;
using System.Net;
using System.Net.Sockets;
using System.Threading.Tasks;

namespace stream
{
    class Program
    {
        internal static (NetworkStream ClientStream, NetworkStream ServerStream) GetConnectedTcpStreams()
        {
            using (Socket listener = new Socket(AddressFamily.InterNetwork, SocketType.Stream, ProtocolType.Tcp))
            {
                listener.Bind(new IPEndPoint(IPAddress.Loopback, 0));
                listener.Listen(1);

                var clientSocket = new Socket(AddressFamily.InterNetwork, SocketType.Stream, ProtocolType.Tcp);
                clientSocket.Connect(listener.LocalEndPoint);
                Socket serverSocket = listener.Accept();

                Console.WriteLine("GetConnectedTcpStreams: {0} {1} client {2} server {3}", clientSocket.LocalEndPoint, clientSocket.RemoteEndPoint, clientSocket.Handle, serverSocket.Handle);
                serverSocket.NoDelay = true;
                clientSocket.NoDelay = true;
                Console.WriteLine("buffers = {0} and {1}", clientSocket.SendBufferSize,  serverSocket.SendBufferSize);

                // NetworkStream streams own socket -> should call Shutdown and write out all data.
                return (new NetworkStream(clientSocket, ownsSocket: true), new NetworkStream(serverSocket, ownsSocket: true));
            }

        }

        static async Task Main(string[] args)
        {
            int count = 1024 * 1024;
            (NetworkStream client, NetworkStream server) = GetConnectedTcpStreams();
            byte[] dataToCopy =  new byte[count];

            using (client)
            {
                // don't read quite yet.
                await client.WriteAsync(dataToCopy, default);
                // Should flush data! (not needed for repro)
                client.Socket.Shutdown(SocketShutdown.Send);
                Console.WriteLine("Write is done!");
            }

            // Attempt to read from server stream would fail here.
        }
    }
}
```

produces 
```
furt@ubu18:~/projects/stream$ ~/dotnet-5.x/dotnet run
GetConnectedTcpStreams: 127.0.0.1:37446 127.0.0.1:41689 client 32 server 34
buffers = 2626560 and 2626560
Write is done!

and capture:

14:26:16.455441 IP localhost.37446 > localhost.41689: Flags [S], seq 2286837102, win 65495, options [mss 65495,sackOK,TS val 99816607 ecr 0,nop,wscale 7], length 0
14:26:16.455449 IP localhost.41689 > localhost.37446: Flags [S.], seq 2347911387, ack 2286837103, win 65483, options [mss 65495,sackOK,TS val 99816607 ecr 99816607,nop,wscale 7], length 0
14:26:16.455456 IP localhost.37446 > localhost.41689: Flags [.], ack 1, win 512, options [nop,nop,TS val 99816607 ecr 99816607], length 0
14:26:16.465777 IP localhost.37446 > localhost.41689: Flags [.], seq 1:32742, ack 1, win 512, options [nop,nop,TS val 99816617 ecr 99816607], length 32741
14:26:16.465783 IP localhost.41689 > localhost.37446: Flags [.], ack 32742, win 381, options [nop,nop,TS val 99816617 ecr 99816617], length 0
14:26:16.465799 IP localhost.37446 > localhost.41689: Flags [P.], seq 32742:65483, ack 1, win 512, options [nop,nop,TS val 99816617 ecr 99816617], length 32741
14:26:16.469147 IP localhost.41689 > localhost.37446: Flags [R.], seq 1, ack 65483, win 512, options [nop,nop,TS val 99816620 ecr 99816617], length 0
```

 App above writes ~ 64K and then sends RST and discards rest of the data. There is no failure shown to the caller. 
Of course read from server would now fail  in way #44175 describes e.g. "SocketException : Connection reset by peer"

Same code runs ok on Windows and all data are written followed by FIN.

I think crucial part of this is fact that the large write is successful. Since there is space in socket buffer data are written to kernel but since server is not reading data, that will fill and close TCP windows. When Shutdown is called, it panics and sends RST instead of waiting for data to be flushed gracefully. 

cc: @geoffkizer @stephentoub @tmds

**Comment by jinek** [comment]
@karelz Again, only in Socket.cs we have empty catch{} 8 times. Plus several times where ExceptionCheck.IsFatal is false. https://github.com/dotnet/runtime/blob/master/src/libraries/Common/src/System/Net/ExceptionCheck.cs
This swallowed exceptions can happen so rear, it just silently does not work.

**Comment by stephentoub** [comment]
@jinek, what does your comment have to do with this issue?

**Comment by jinek** [comment]
@stephentoub Sorry, I should ellaborate the point: having even one single empty "catch" of general System.Exception puts the application into undetermined state **silently** .
Theoretically, denending on the complexity of the situation it could never happen to be determined by developers.
Still, by removing all empty catches and following CA1031, we would to get rid of any kind of silence. Any caller could have the stack trace immediately.

Additionally, relying on ExceptionCheck.IsFatal makes it worse, because it assumes that

```
throw new NotImplementedException("This case has not been considered for linux yet. Stream can silently discard data from now");
```

is somehow not so bad for the client as 

```
var data = new byte[int.MaxValue];
```

**Comment by stephentoub** [comment]
But what does that have to do with this issue you're commenting on?

**Comment by jinek** [comment]
@stephentoub Hmm, now I'm not sure that this is the corrent issue which I tried to tag.
Isn't this "There is no failure shown to the caller." the root part of the issue? Because my further point is about silent failures exactly.
If it does not make a point here, could we please just remove this comments?

**Comment by stephentoub** [comment]
> Isn't this "There is no failure shown to the caller." the root part of the issue?

No,  this issue is about data successfully written to a socket triggering an RST when the socket is closed and that data hasn't propagated to the recipient.

**Comment by geoffkizer** [comment]
That is very strange and concerning. 

@wfurt are you investigating further?

Some quick thoughts:
(1) Would probably be good to remove NetworkStream and use Socket directly. I can't imagine this makes a difference, but we should confirm just to be sure.
(2) Might be interesting to try sync instead of async, see if it has the same issue.

**Comment by wfurt** [comment]
per's @geoffkizer hint, I added the read and I it works. 

This is trace from the original test failure with TLS1.3
```
22:56:52.403310 IP localhost.49616 > localhost.40015: Flags [S], seq 1717710016, win 65495, options [mss 65495,sackOK,TS val 130428480 ecr 0,nop,wscale 7], length 0
22:56:52.403317 IP localhost.40015 > localhost.49616: Flags [S.], seq 2107472083, ack 1717710017, win 65483, options [mss 65495,sackOK,TS val 130428480 ecr 130428480,nop,wscale 7], length 0
22:56:52.403324 IP localhost.49616 > localhost.40015: Flags [.], ack 1, win 512, options [nop,nop,TS val 130428480 ecr 130428480], length 0
22:56:52.435057 IP localhost.49616 > localhost.40015: Flags [P.], seq 1:250, ack 1, win 512, options [nop,nop,TS val 130428512 ecr 130428480], length 249
22:56:52.435069 IP localhost.40015 > localhost.49616: Flags [.], ack 250, win 510, options [nop,nop,TS val 130428512 ecr 130428512], length 0
22:56:52.452397 IP localhost.40015 > localhost.49616: Flags [P.], seq 1:2218, ack 250, win 512, options [nop,nop,TS val 130428529 ecr 130428512], length 2217
22:56:52.452407 IP localhost.49616 > localhost.40015: Flags [.], ack 2218, win 500, options [nop,nop,TS val 130428529 ecr 130428529], length 0
22:56:52.453821 IP localhost.49616 > localhost.40015: Flags [P.], seq 250:330, ack 2218, win 512, options [nop,nop,TS val 130428531 ecr 130428529], length 80
22:56:52.455376 IP localhost.40015 > localhost.49616: Flags [P.], seq 2218:2696, ack 330, win 512, options [nop,nop,TS val 130428532 ecr 130428531], length 478
22:56:52.471723 IP localhost.49616 > localhost.40015: Flags [.], seq 330:33098, ack 2696, win 509, options [nop,nop,TS val 130428549 ecr 130428532], length 32768
22:56:52.471739 IP localhost.49616 > localhost.40015: Flags [P.], seq 33098:33142, ack 2696, win 509, options [nop,nop,TS val 130428549 ecr 130428532], length 44
22:56:52.472898 IP localhost.40015 > localhost.49616: Flags [.], ack 33142, win 507, options [nop,nop,TS val 130428550 ecr 130428549], length 0
22:56:52.472939 IP localhost.49616 > localhost.40015: Flags [.], seq 33142:65910, ack 2696, win 509, options [nop,nop,TS val 130428550 ecr 130428550], length 32768
22:56:52.478069 IP localhost.40015 > localhost.49616: Flags [.], ack 65910, win 512, options [nop,nop,TS val 130428555 ecr 130428550], length 0
22:56:52.478094 IP localhost.49616 > localhost.40015: Flags [.], seq 65910:98678, ack 2696, win 509, options [nop,nop,TS val 130428555 ecr 130428555], length 32768
22:56:52.478098 IP localhost.49616 > localhost.40015: Flags [.], seq 98678:131446, ack 2696, win 509, options [nop,nop,TS val 130428555 ecr 130428555], length 32768
22:56:52.478419 IP localhost.40015 > localhost.49616: Flags [.], ack 131446, win 0, options [nop,nop,TS val 130428555 ecr 130428555], length 0
22:56:52.479012 IP localhost.40015 > localhost.49616: Flags [.], ack 131446, win 379, options [nop,nop,TS val 130428556 ecr 130428555], length 0
22:56:52.479037 IP localhost.49616 > localhost.40015: Flags [.], seq 131446:164214, ack 2696, win 509, options [nop,nop,TS val 130428556 ecr 130428556], length 32768
22:56:52.483675 IP localhost.40015 > localhost.49616: Flags [.], ack 164214, win 512, options [nop,nop,TS val 130428561 ecr 130428556], length 0
22:56:52.483694 IP localhost.49616 > localhost.40015: Flags [.], seq 164214:196982, ack 2696, win 509, options [nop,nop,TS val 130428561 ecr 130428561], length 32768
22:56:52.483697 IP localhost.49616 > localhost.40015: Flags [.], seq 196982:229750, ack 2696, win 509, options [nop,nop,TS val 130428561 ecr 130428561], length 32768
22:56:52.484836 IP localhost.40015 > localhost.49616: Flags [.], ack 229750, win 0, options [nop,nop,TS val 130428562 ecr 130428561], length 0
22:56:52.485148 IP localhost.40015 > localhost.49616: Flags [.], ack 229750, win 379, options [nop,nop,TS val 130428562 ecr 130428561], length 0
22:56:52.485163 IP localhost.49616 > localhost.40015: Flags [.], seq 229750:262518, ack 2696, win 509, options [nop,nop,TS val 130428562 ecr 130428562], length 32768
22:56:52.487594 IP localhost.49616 > localhost.40015: Flags [R.], seq 262518, ack 2696, win 512, options [nop,nop,TS val 130428565 ecr 130428562], length 0
```

So perhaps the reason is different. I'll try few more things tomorrow. As well as I'm wondering if this is some quirk of the loopback.

**Comment by tmds** [comment]
This issue is not reproducing for me on Fedora 32:

```diff
                 Console.WriteLine("Write is done!");
             }
 
-            // Attempt to read from server stream would fail here.
+            int bytesRead;
+            int bytesReadTotal = 0;
+            byte[] buffer = new byte[1024];
+            do
+            {
+                bytesRead = server.Read(buffer);
+                bytesReadTotal += bytesRead;
+            } while (bytesRead != 0);
+            Console.WriteLine($"Read {bytesReadTotal} bytes.");
         }
     }
 }
```

```
$ dotnet --version
5.0.100-preview.8.20417.9
$ dotnet run
GetConnectedTcpStreams: 127.0.0.1:46110 127.0.0.1:33935 client 32 server 34
buffers = 2626560 and 2626560
Write is done!
Read 1048576 bytes.
```

**Comment by wfurt** [comment]
Hey @tmds, I could not reproduce it with the read either. As I was thinking about it more, I still feel that writer _should_ know if sending failed even if receiver failed to read. 

However, to focus on the problem I was trying to debug, I forked the test to standalone app and I put it here: https://github.com/wfurt/socketResetRepro
For now, I can reproduce the reset only when I use the SSL path. When I did packet captures it changes how TCP  flows and there may be some hidden trigger to it. 

I also installed Fedora32 as 2core VM and I was able to reproduce it as well - even if that seems to happen less frequently. I used the loop.sh to simply run self-contained app over and over until it fails. I was able to see that with 3.1, 5.0 and 6.0 .NET and it feels like this is caused by some kernel behavior we don't fully understand.   

With the standalone app, I was finally able to capture system calls with `strace`
[trace.FAILED.txt](https://github.com/dotnet/runtime/files/5558164/trace.FAILED.txt)

You can see simple exchange between client and server (descriptor 27 and 30)
```
13170      0.000020 sendmsg(27, {msg_name=NULL, msg_namelen=0, msg_iov=[{iov_base="\27\3\3@\21\213_Q\32\357\237\355[\335\25Rv\216\343\336\350\2\324\330\332\341qT\347qj\344Y\375\326\20\0301\307\314\313\240\241\2133\350\212\246\35\r\264$\24\342\365D\325<.\201\31<\356\201\5\1\333=\223\nEctJ\201\357\217\4\2\252\7\t\2610n\370\362\370o\20AY\356\25\255\16o8\251\312"..., iov_len=32812}], msg_iovlen=1, msg_controllen=0, msg_flags=0}, 0 <unfinished ...>
13175      0.002048 <... recvmsg resumed> {msg_name=NULL, msg_namelen=0, msg_iov=[{iov_base="\32\315\331\363Kl\263\2430e\235\37C\223\7\2450[\334\37\25&\310\27\376\215\276\220\22\254T\356\200\301<k\24\333\203a\t(\350\373\27\3\3@\21&\347\234r\27\357X\21G$\237i}\200Y\3533\214\37G\3143R>\354@\302\342\226!\271i3\276\t+\350Z\373\353\245\254\317\222)8\212\374zj\246"..., iov_len=16406}], msg_iovlen=1, msg_controllen=0, msg_flags=0}, 0) = 16406
13170      0.000026 <... sendmsg resumed> ) = 32812
13170      0.000061 sendmsg(27, {msg_name=NULL, msg_namelen=0, msg_iov=[{iov_base="\27\3\3@\21\177\257\rL\23,\220Ht\26561\312]c\216\203Hc\6\"\365)\332\255N\26q\313\233\342\f[E\225\310\376\371T4\v,\274hZ\306\212\321\264\341v\206t\6X\0370\256y9\26k\264\276b\274\240\246!\226h\267S\317\376\3547\207)\222\217Z\214\243\221E\361sq1\223\27\325T\205"..., iov_len=32812}], msg_iovlen=1, msg_controllen=0, msg_flags=0}, 0) = 32812
13170      0.000095 sendmsg(27, {msg_name=NULL, msg_namelen=0, msg_iov=[{iov_base="\27\3\3@\21\251\31\24\7\227\2163\267o\247\255\333\250\331\262\370\307.X'\344'\331N\223\33J\321\260\306\21\200\360\274:\306\341:\6\232\26\r\27/\336\320\331\205~+5\225q\205\272\v\27)\352\33\340ike/\304\237\373?\310\313g\227\277\276\212\247H^S\f\215\234Kv\250\275\207\36h`\362\225U\206"..., iov_len=32812}], msg_iovlen=1, msg_controllen=0, msg_flags=0}, 0) = 32812
13170      0.000077 sendmsg(27, {msg_name=NULL, msg_namelen=0, msg_iov=[{iov_base="\27\3\3@\21\304\36V\304\232\222m\4\223k\223\4hO\2579>\272\366\302.Q\344\366 \3241\347$\256\211\fR\215w\3\17\23\272\223\222\32\2055\22t\t\363o\303s4+]\340\263aP\356U\265\356}\233\375\237\236J\350\200\373\354\3\27\2469\222\233\1\277\tn\3026\333\327\7X\7\v\226\326\35l\271"..., iov_len=32812}], msg_iovlen=1, msg_controllen=0, msg_flags=0}, 0) = 32812
13170      0.000090 sendmsg(27, {msg_name=NULL, msg_namelen=0, msg_iov=[{iov_base="\27\3\3@\21\337.R\205#\333[\263t\232KJ\363\231\7\361%\377\332\317\214\\\366\321\253l\5\2160\344\35\245\372\6\315\351\10\364\3125TU\321r\314L\307\364\245\304\320\223\317;]=\225j\333_\275I\247\202\341n\24L\244 G\36\312v\31x\312\34\251q\3764?\305\322'\226A\233_\0\347\210e`"..., iov_len=32812}], msg_iovlen=1, msg_controllen=0, msg_flags=0}, 0) = 32812
13170      0.000092 sendmsg(27, {msg_name=NULL, msg_namelen=0, msg_iov=[{iov_base="\27\3\3@\21\255\241\352\230K\356I\371\17Y\f#\375\\\332\356/\306\277\233\325q\335\241V\21\336\232\247fh\301\370>SaS\222\275\360-\fu=\273u8\210)\377\226\233\263 \330z\255*3 \216!\251P\222\16f\0248\300V\25\373\313\301GG\32\373V+yI`\35\2\225\202M\354t\203\274?c"..., iov_len=32812}], msg_iovlen=1, msg_controllen=0, msg_flags=0}, 0) = 32812
13170      0.000088 sendmsg(27, {msg_name=NULL, msg_namelen=0, msg_iov=[{iov_base="\27\3\3@\0215\30\32\237\346{]\317\250\255\301\3119g\264\204\f\2325\37\335\"\276\6\23\20\365\31\224z\32\214\240Z\315\234\365\27}\322\303\364\254\30OB\236xh\377\246\203!\224k$;\22\1\343\235\222\217\27\353+\330\365s%\260C(\276\303k-\243\245\217\272W\0229\1\301@\355\336\214\342\355\274H\365"..., iov_len=32812}], msg_iovlen=1, msg_controllen=0, msg_flags=0}, 0) = 32812
13170      0.000526 sendmsg(27, {msg_name=NULL, msg_namelen=0, msg_iov=[{iov_base="\27\3\3@\21\367\336\3\2754\356u\23\7\215\263\313~\204${\6\345\222P\234\22L\352)4{\212\357\371\347\fr\6lM<\344\31t\2516\244\ng\23\347\275k\200&\245\317T\224\23\316\364\375\35W\\+\216\22\354\271\325\234\330\256\225?\342l,i\26\247P\362\375\237S$\373\256G\377\306\315\2\301RE"..., iov_len=32812}], msg_iovlen=1, msg_controllen=0, msg_flags=0}, 0) = 32812
13170      0.000100 sendmsg(27, {msg_name=NULL, msg_namelen=0, msg_iov=[{iov_base="\27\3\3@\21\243z\265\316\231\374\354\v\353\236 \301\243\332\377\357\250!\305\355L\344(\301;}S\305\337\231\255\vb\263`lQ\225\343v\\x\372\215\262\341p\305\350jb\250\223\257U\344\255\23\24\216\202U\226\321\307\335:?\306\267\347\346\250b\212\221\22\201T\364\207\354\362\301\345\261n\353\336\253\3527b\363\205"..., iov_len=32812}], msg_iovlen=1, msg_controllen=0, msg_flags=0}, 0) = 32812
13170      0.000092 sendmsg(27, {msg_name=NULL, msg_namelen=0, msg_iov=[{iov_base="\27\3\3@\21\202\2\255\301\371,\4u\370\222\316\v\275\344F\202\202\315\221\325\207Vz\264\353\270\307\260\306\267\275kc\357\271\25\361\236\2608A!\324\353\236d\354b\241qSIvxGhRO\27?\300\231m\242Q\333\34\326\226V\31\315{\31468-R\307\2164lr;$:\263\270\273_\2102v\305\376"..., iov_len=32812}], msg_iovlen=1, msg_controllen=0, msg_flags=0}, 0) = 32812
13170      0.000097 sendmsg(27, {msg_name=NULL, msg_namelen=0, msg_iov=[{iov_base="\27\3\3@\0211\314\372\360/}-u>\266\33\235\273k\210\327\331Z+\270\220\r\360\\T\352\303\341\236_\370Ly<R\232\327Y,j\354\254\273\326^\305\365\300\261\347\n{\302\265\234\352\247C\325\343=5\211g\363\331\276\233h}Y\361\352\351\336\2516>\212\2254\243\253\1+\252\177\236\330MJ\244\2355#"..., iov_len=32812}], msg_iovlen=1, msg_controllen=0, msg_flags=0}, 0) = 32812
13170      0.000091 sendmsg(27, {msg_name=NULL, msg_namelen=0, msg_iov=[{iov_base="\27\3\3@\21\277p\360K\201\205A\233\242\345\326\24@\271l\17\250\227EL\177\217\317\177q\275\254y\2623\260w\7\354x\1\212+\316\32\210\326\0(\261S\2_Jg/6\365+\212\307D*'\236{\374v>{\350T13\304`\253\7jo\204\253\357\36\365#\330`\4\314oy\274b\10\317\320l!@"..., iov_len=32812}], msg_iovlen=1, msg_controllen=0, msg_flags=0}, 0) = 32812
13170      0.000108 sendmsg(27, {msg_name=NULL, msg_namelen=0, msg_iov=[{iov_base="\27\3\3@\21h+\322bO\220K\202\371\305HA{*\310\254s\202\234\255\226\255\360H\321E'\335\246\307]\2 \30\257\304A\375=&\252\355\21\n\266>\374\215\33D\v\301\224\177j\270\225cI\204\35kuQ\265\224\t\345\342\203\5\363\20E\2411\315\251d\237\v\324\277\235\t\23\310<\234\240\376eiM\200"..., iov_len=32812}], msg_iovlen=1, msg_controllen=0, msg_flags=0}, 0) = 32812
13170      0.000107 sendmsg(27, {msg_name=NULL, msg_namelen=0, msg_iov=[{iov_base="\27\3\3@\21\300s\314Cb\v\330\260\364\204\375\251.\265q\232/W \260\276\36\350\321\246[A$K\16\37\211\305_\276*\3646\364\17\312\312\275\265\274\2677\364\v~>Q\275s\250\330\226X)\37a\244\225\244\32\17\361\"~\261\307P\2052o\250\32=\356\322p0\n\357\350\262N\207\205\255\265\372R\222\10"..., iov_len=32812}], msg_iovlen=1, msg_controllen=0, msg_flags=0}, 0) = 32812
13170      0.000097 sendmsg(27, {msg_name=NULL, msg_namelen=0, msg_iov=[{iov_base="\27\3\3@\0216\260\7\5u\3\303Z\321\232\304\34*\257\20\350\f\335\344\n\31\301/\30v\203=;\357\265M\337\221\v\330\204\312\300\23\250\275\230B\357\253u\0\3319\225vj\27@\365\"\233\311\252U@\332\226\36\21\246#\241x\200\37#\227\"0WG\317\303;_F\37J\367t\276\2635p\26\10B\16\326"..., iov_len=32812}], msg_iovlen=1, msg_controllen=0, msg_flags=0}, 0 <unfinished ...>
13175      0.000017 recvmsg(30,  <unfinished ...>
13170      0.000011 <... sendmsg resumed> ) = 32812
13175      0.000033 <... recvmsg resumed> {msg_name=NULL, msg_namelen=0, msg_iov=[{iov_base="<>^\323Kp\v\270o\231\366\324\375U\250\32\315\35\266E\17\20\267\342\327\274\361\247>\243\30\231\22445\354\4\270T@ \341\334X\27\3\3@\21Y[\210\325hK\226\25\275\221\3269$\374\332Dz\361\300\224\335\23\372!\375\360\307\245-4\363\363\33\353\260\350\344\203M\215^tO=\f1f\36\242t&"..., iov_len=16406}], msg_iovlen=1, msg_controllen=0, msg_flags=0}, 0) = 16406
13175      0.000068 recvmsg(30, {msg_name=NULL, msg_namelen=0, msg_iov=[{iov_base="\340@7=[\320@\2P\307\260x\275\264\264J\271\367\206F\274\6\210\261\220\357^&\27\272D\331\35T\365i\21\35\261\334\27\311\30A\27\3\3@\21$j\231\336\33\376,\10\353\35\243\224=q\342\2067\266_^${\3P\v\7\234d'e\302\266E\373A\246\v\276\335\21%,\331q5/\373\221\362\360\347"..., iov_len=16406}], msg_iovlen=1, msg_controllen=0, msg_flags=0}, 0) = 16406
13170      0.001661 shutdown(27, SHUT_RDWR) = 0
13175      0.003360 recvmsg(30, {msg_name=NULL, msg_namelen=0, msg_iov=[{iov_base="4K[\34)\206\233\4\313=\363\233T\324\261\301\373\233\267e?\tV\256Er\33H\276\n|\320a\0\21\345\255\315i\213\331\301I\31\27\3\3@\21\205\307iB\230oE\246o\203(;\2Z?\366\254\\\272[\"\215\242\33W\262s\324\351$nxKG\32UU\33\267\211g\256L\346\222=\n\372\306\265\236"..., iov_len=16406}], msg_iovlen=1, msg_controllen=0, msg_flags=0}, 0) = 16406
13175      0.000666 recvmsg(30, {msg_name=NULL, msg_namelen=0, msg_iov=[{iov_base="1e-!\330\310n\244\260\t#\311\346?L\332/\242\365\305\36\213\265Z\325\34c>\vL\341\263{y\267\227\314\222q\362\253\362-\232\27\3\3@\21\16\3250\243:)\nrc\220\217\211D5\0\36\t\7\35\317\21\16\355\17\356\23\307\256.\336\201t\330\257P\267\354\252\271\201q\263\315\177D\30\257\320\24\n\26"..., iov_len=16406}], msg_iovlen=1, msg_controllen=0, msg_flags=0}, 0) = 16406
13175      0.000685 recvmsg(30, {msg_name=NULL, msg_namelen=0, msg_iov=[{iov_base=".eq\177\236\312\2578|N\301\326\2274\376\232\344r\322\23i\5\316\266B\263\245\303\0^\3(\226\300\347\212\314\26j<\312\266P\304\27\3\3@\21\352S\350I\"\224M\16\276\344\356-\220b\260n\251xz\233\244S\376\31\370ei\37W\345\230\242\21Y\263N\311y\33\364\220\331\334o\344c\206[X\233\35"..., iov_len=16406}], msg_iovlen=1, msg_controllen=0, msg_flags=0}, 0) = 16406
13175      0.000665 recvmsg(30, {msg_name=NULL, msg_namelen=0, msg_iov=[{iov_base="\221R\352k\37\243n\26U\23\210i\365\363\276\350R?!>{\0Rk\223\vI\327\351\241\352}e>\357c\312\237\273\366\255f\231$\27\3\3@\21\26N\253\354\203\224\274\251\372\233\16\363\0048[\320\303\306?w_\3C\332l\250\253C\30l\320\227\266o\326i\236SuG\32\324U)\320\243{\277\221ew"..., iov_len=16406}], msg_iovlen=1, msg_controllen=0, msg_flags=0}, 0) = 16274
13175      0.008413 recvmsg(30, {msg_namelen=0}, 0) = -1 ECONNRESET (Connection reset by peer)
13158      0.070876 --- SIGABRT {si_signo=SIGABRT, si_code=SI_TKILL, si_pid=13158, si_uid=1001} ---
```

the sender would call shutdown() and the recover would get RST.

**Comment by tmds** [comment]
Tomas, thanks for the additional info, I'll take a closer look at the reproducer and strace.

> I still feel that writer should know if sending failed even if receiver failed to read.

That's not reported to the writer. The writer is only aware of when the send buffer is filled which causes the `sendmsg` to block, or return `EAGAIN` when non-blocking. To really know the data was received, the protocol above needs to send a confirmation message. This not only confirms that the peer received the message, but also that it performed the application logic related to the request.

> I was able to see that with 3.1, 5.0 and 6.0 .NET and it feels like this is caused by some kernel behavior we don't fully understand.

I thought it may be a regression caused by https://github.com/dotnet/corefx/pull/38804, but that is not the case since it also repros on 3.1.

**Comment by wfurt** [comment]
man pages suggest the `close` should show any delayed errors. And yes, I was wondering about the abortive changes but so far I saw no evidence it is related. Let's see if you can reproduce and see the reset when running with ssl.

**Comment by tmds** [comment]
I can reproduce the issue.

I expected the data to stay around in the kernel for some time, but after having a look at the kernel sources, it seems data may get discarded on close, and cause a RST to inform the peer: https://github.com/torvalds/linux/blob/0fa8ee0d9ab95c9350b8b84574824d9a384a9f7d/net/ipv4/tcp.c#L2454-L2458.

I think the behavior we see comes from the kernel because the trace doesn't show anything from .NET side to trigger this.
I don't think there is something we can (and should) do about it.

**Comment by stephentoub** [comment]
How can code be reliable in the face of that? e.g. if I'm a web server sending back a Connection: close response, I write the response body and then close the connection... doesn't that end up in this same condition?

**Comment by tmds** [comment]
> How can code be reliable in the face of that? e.g. if I'm a web server sending back a Connection: close response, I write the response body and then close the connection... doesn't that end up in this same condition?

Good point.

I just noticed that the condition in kernel code I highlighted is `data_was_unread`.
So maybe there is still some data to be read by the sender when it calls close.

**Comment by tmds** [comment]
> So maybe there is still some data to be read by the sender when it calls close.

That is what is happening here.

These are the messages that get sent from the receiver to the sender:
```
[pid 144116] 12:43:34 recvmsg(27, {msg_namelen=0}, 0) = -1 EAGAIN (Resource temporarily unavailable)
[pid 144125] 12:43:34 sendmsg(30, {msg_name=NULL, msg_namelen=0, msg_iov=[{iov_base="\26\3\3\0z\2\0\0v\3\3=\362\210\7\375\3e\274\327\316\2\321E\264UWKn\2607\36"..., iov_len=1341}], msg_iovlen=1, msg_controllen=0, msg_flags=0}, 0) = 1341
[pid 144128] 12:43:34 recvmsg(27,  <unfinished ...>
[pid 144128] 12:43:34 recvmsg(27, {msg_name=NULL, msg_namelen=0, msg_iov=[{iov_base="\2\0\0v\3\3=\362\210\7\375\3e\274\327\316\2\321E\264UWKn\2607\36[\306\273mC"..., iov_len=122}], msg_iovlen=1, msg_controllen=0, msg_flags=0}, 0) = 122
[pid 144128] 12:43:34 recvmsg(27, {msg_name=NULL, msg_namelen=0, msg_iov=[{iov_base="\24\3\3\0\1", iov_len=5}], msg_iovlen=1, msg_controllen=0, msg_flags=0}, 0) = 5
[pid 144128] 12:43:34 recvmsg(27, {msg_name=NULL, msg_namelen=0, msg_iov=[{iov_base="\1", iov_len=1}], msg_iovlen=1, msg_controllen=0, msg_flags=0}, 0) = 1
[pid 144128] 12:43:34 recvmsg(27, {msg_name=NULL, msg_namelen=0, msg_iov=[{iov_base="\27\3\3\0\27", iov_len=5}], msg_iovlen=1, msg_controllen=0, msg_flags=0}, 0) = 5
[pid 144128] 12:43:34 recvmsg(27, {msg_name=NULL, msg_namelen=0, msg_iov=[{iov_base="\234\213\371\347\345\253\244\304\354r\276\367\254_\7\315\3011\343\355\262\215\330", iov_len=23}], msg_iovlen=1, msg_controllen=0, msg_flags=0}, 0) = 23
[pid 144128] 12:43:34 recvmsg(27, {msg_name=NULL, msg_namelen=0, msg_iov=[{iov_base="\27\3\3\3/", iov_len=5}], msg_iovlen=1, msg_controllen=0, msg_flags=0}, 0) = 5
[pid 144128] 12:43:34 recvmsg(27, {msg_name=NULL, msg_namelen=0, msg_iov=[{iov_base="\264;(\270g\205\334\37'\240*\34\346\200\222\224\377\254\277R%\25U\265D\7x5w=\375\326"..., iov_len=815}], msg_iovlen=1, msg_controllen=0, msg_flags=0}, 0) = 815
[pid 144128] 12:43:34 recvmsg(27, {msg_name=NULL, msg_namelen=0, msg_iov=[{iov_base="\27\3\3\1\31", iov_len=5}], msg_iovlen=1, msg_controllen=0, msg_flags=0}, 0) = 5
[pid 144128] 12:43:34 recvmsg(27,  <unfinished ...>
[pid 144128] 12:43:34 recvmsg(27, {msg_name=NULL, msg_namelen=0, msg_iov=[{iov_base="\27\3\3\0E", iov_len=5}], msg_iovlen=1, msg_controllen=0, msg_flags=0}, 0) = 5
[pid 144128] 12:43:34 recvmsg(27, {msg_name=NULL, msg_namelen=0, msg_iov=[{iov_base="\353Mi\214\352\1\320?\316 m\246\21\213\5R\336v/)\271N\30\316DGg\205:\225\200t"..., iov_len=69}], msg_iovlen=1, msg_controllen=0, msg_flags=0}, 0) = 69
[pid 144132] 12:43:34 sendmsg(30, {msg_name=NULL, msg_namelen=0, msg_iov=[{iov_base="\27\3\3\0\352\307(\240\204\361\227'4\3334\212\257\2446\325\36.\25\222\2016\366\217%\376s."..., iov_len=478}], msg_iovlen=1, msg_controllen=0, msg_flags=0}, 0) = 478
[pid 144128] 12:43:34 close(27 <unfinished ...>
```

which then leads to:
```
[pid 144131] 12:43:34 recvmsg(30, {msg_name=NULL, msg_namelen=0, msg_iov=[{iov_base="n\10(L\326\0013\223O\372\254\3\204\322\377\2\222y\230\274\310\220%\224\211\330\306]>v\340\332"..., iov_len=16406}], msg_iovlen=1, msg_controllen=0, msg_flags=0}, 0) = 16406
[pid 144131] 12:43:34 recvmsg(30, {msg_name=NULL, msg_namelen=0, msg_iov=[{iov_base="(5/\244b\20\237\351\321\307\303\244e0\217\377\7u\364\255\203bd\237\337\273\n\2137A$Q"..., iov_len=16406}], msg_iovlen=1, msg_controllen=0, msg_flags=0}, 0) = 16362
[pid 144131] 12:43:34 recvmsg(30, {msg_namelen=0}, 0) = -1 ECONNRESET (Connection reset by peer)
```

**Comment by tmds** [comment]
So, when `close` is called on a socket with pending data to be read, the peer gets a RST close.

```cs
using System.Net;
using System.Net.Sockets;

namespace stream
{
    class Program
    {
        internal static (Socket socket1, Socket Socket2) CreateConnectedSockets()
        {
            using (Socket listener = new Socket(AddressFamily.InterNetwork, SocketType.Stream, ProtocolType.Tcp))
            {
                listener.Bind(new IPEndPoint(IPAddress.Loopback, 0));
                listener.Listen(1);

                var socket1 = new Socket(AddressFamily.InterNetwork, SocketType.Stream, ProtocolType.Tcp);
                socket1.Connect(listener.LocalEndPoint);
                Socket socket2 = listener.Accept();

                return (socket1, socket2);
            }

        }

        static void Main(string[] args)
        {
            (Socket socket1, Socket socket2) = CreateConnectedSockets();
            socket1.Send(new byte[1]);
            socket2.Close();
            socket1.Receive(new byte[1]);
        }
    }
}
```

```
$ dotnet run
Unhandled exception. System.Net.Sockets.SocketException (104): Connection reset by peer
   at System.Net.Sockets.Socket.Receive(Byte[] buffer) in /_/src/System.Net.Sockets/src/System/Net/Sockets/Socket.cs:line 1369
   at stream.Program.Main(String[] args) in /tmp/console2/Program.cs:line 29
```

**Comment by stephentoub** [comment]
What data is pending to be read on the original repro?

**Comment by tmds** [comment]
Something related to SSL.

**Comment by tmds** [comment]
Which is why https://github.com/dotnet/runtime/issues/44764#issuecomment-729461345:

> For now, I can reproduce the reset only when I use the SSL path.

**Comment by stephentoub** [comment]
I meant the original repro in this issue's top post, which only uses NetworkStream.

> Which is why #44764 (comment):

Ah, so this issue isn't actually an issue?

**Comment by tmds** [comment]
Yes, and what we found out may be the root cause for https://github.com/dotnet/runtime/issues/44175.

**Comment by geoffkizer** [comment]
I wasn't able to repro with the original repro either.

@wfurt Any objection to closing this now?

**Comment by wfurt** [comment]
I don't care if we close it @geoffkizer. But I still feel it would be nice to know if data were not delivered to the peer while using TCP/NetworkStream. Without the added read it is clearly the case but there is no indication of problem to the writer.
Adding the read as you and @tmds suggested avoids the reset - but I think that can be only timing. 

From what I can tell from the traces the reason why the test(s) is unreliable is networking not SSL. From what I can see, SSL changes timing, TCP flow and system load.  #44175 describes only one test failure but we have seen similar random failures in other tests as well. So I feel it would better to keep this one open for networking, also because it has more insight now than the other one so it may be easier to follow.

**Comment by geoffkizer** [comment]
If you close a socket with pending unread data -- or if data arrives after the close -- this will cause a RST. This is how TCP has always worked. That way, the peer knows that not all data that it sent was processed.

If you want to avoid a RST in general, then you need to read until you receive EOF from the peer.

I don't understand the specific issue here with SSL well enough. Can you provide more detail? (Other issue is probably a better place for it.)

**Comment by stephentoub** [comment]
@wfurt, you've mentioned in the past about various SSL alerts being generated, and how sometimes based on timing they're consumed as part of the authentication handshake and sometimes they're not consumed until there's a subsequent read operation.  I'm wondering if we might be seeing something similar here, e.g. some silent (from the perspective of the app-level code) data is being sent from the client to server and then the server app code writes down to the client and closes the connection, not realizing there was actually this "silent" protocol-level data to be consumed.  Random musings.

**Comment by wfurt** [comment]
This is driving me nuts as I was trying to make repro without SSL but I'm failing to mimic the behavior exactly. In my attempt to repro and the CopyToAsync_AllDataCopied_Large part of the problem is possibly fact that this is unidirectional e.g. on side only writes. But without attempt to read, the errors would not flow back. 

Now, @tmds suggested there are cases when kernel can drop the data and send reset.
What should be mitigation for our tests? It seems like most of them assume written data will arrive to the other side and we do not seems to coordinate disposal. What strategy should we take @stephentoub ? We can simply disable or rewrite that particular test and look for similar patterns as we see random failures. 

I'll try to get more captures and traces and I'll keep trying to make good repro without SSL @geoffkizer. Perhaps we can chat tomorrow.

**Comment by geoffkizer** [comment]
> Now, @tmds suggested there are cases when kernel can drop the data and send reset.

The only case we know about is the case he identified, where the receive buffer is not empty. This is expected.

I do wonder whether we have a real product issue here or not. I'm assuming that something like what @stephentoub suggested above is happening -- that is, even though the peer isn't sending any app data, it is sending some sort of alert or notification that we never read, so when we close the socket a RST gets sent. This seems like an issue customers could actually run into in practice.

I'm not sure what the expect shutdown protocol for SSL is -- seems like there must be some way to tell the peer "i'd like to shut down", and it can respond affirmatively, and once you get that you know there's no more data that will arrive and you can safely shut down the socket.

**Comment by geoffkizer** [comment]
I think we should:
(1) Confirm (or disprove) that the RST is occurring because of unread data in the receive buffer
(2) Figure out what's in the receive buffer 

That should help us figure out what (if anything) we should do about this.

**Comment by tmds** [comment]
> (1) Confirm (or disprove) that the RST is occurring because of unread data in the receive buffer

https://github.com/dotnet/runtime/issues/44764#issuecomment-729629074 shows it.

> seems like there must be some way to tell the peer "i'd like to shut down"

Seems SSL has "close notify" messages: https://stackoverflow.com/questions/45259977/how-does-a-server-know-that-it-recieved-an-ssl-close-notify.

**Comment by geoffkizer** [comment]
Thanks, I forgot you did that already.

It does seem like we should (a) send a "close notify" on Dispose; (b) wait a reasonable amount of time for the peer's "close notify" to arrive and then close the socket; (c) if we don't receive the peer's "close notify" in a reasonable amount of time, we should close anyway, which will likely cause a RST, but that's good in this case. I don't know how much of that, if any, we are doing today... 

I'm still curious about what the actual data in the receive buffer is here; it seems strange that we only see this occasionally. Is the server only sending the data occasionally? Or are we usually reading it and emptying the receive buffer, but occasionally there's a race and we don't?

**Comment by tmds** [comment]
We don't do close notify:

https://github.com/dotnet/runtime/blob/ffc0b7aa63799732b8c863228cf99c5ec3301222/src/libraries/Common/src/Interop/Unix/System.Security.Cryptography.Native/Interop.OpenSsl.cs#L113-L120

If we were, I don't expect this to work for the `CopyToAsync_AllDataCopied_Large` test. `CopyToAsync_AllDataCopied` is serializing the `Dispose` from the two streams. In order for them to interact they should be running concurrently.

> I do wonder whether we have a real product issue here or not.

An interesting case to test is what @stephentoub mentioned in https://github.com/dotnet/runtime/issues/44764#issuecomment-729609924:

> if I'm a web server sending back a Connection: close response, I write the response body and then close the connection... doesn't that end up in this same condition?

Based on what we've seen, the client may end up with only part of the response followed by `ECONNRESET`.

I'm not sure we should be adding the close notify. Based on https://trac.nginx.org/nginx/ticket/1270 nginx/MSIE/major browsers don't:
```
        /*
         * The majority of browsers do not send the "close notify" alert.
         * Among them are MSIE, old Mozilla, Netscape 4, Konqueror,
         * and Links.  And what is more, MSIE ignores the server's alert.
         *
         * Opera and recent Mozilla send the alert.
         */

        c->ssl->no_wait_shutdown = 1;
```

**Comment by geoffkizer** [comment]
>> if I'm a web server sending back a Connection: close response, I write the response body and then close the connection... doesn't that end up in this same condition?

> Based on what we've seen, the client may end up with only part of the response followed by ECONNRESET.

How so? The only case in which the server should send RST is if it has unread data in its receive buffer. Assuming it has read the entire request from the client, there shouldn't be any data in the receive buffer at the point where it closes the connection.

> I'm not sure we should be adding the close notify. Based on https://trac.nginx.org/nginx/ticket/1270 nginx/MSIE/major browsers don't:

Thanks, that's good info. Given that and that we've never sent close_notify before, we probably don't want to add it now. But we still need to understand what's happening in this particular case.

**Comment by tmds** [comment]
> How so? The only case in which the server should send RST is if it has unread data in its receive buffer. Assuming it has read the entire request from the client, there shouldn't be any data in the receive buffer at the point where it closes the connection.

I mean when the server uses http**s**. The unread data that causes the RST is SSL data, like what we see with the `CopyToAsync_AllDataCopied_Large` test.

**Comment by geoffkizer** [comment]
> I mean when the server uses https. 

Ah yeah, of course.

**Comment by wfurt** [comment]
I finally run all the test variations I wanted and here is what I learn:

1. The RST _is_ caused by unread data on writing side as @tmds suspected. Neither `Shutdown` nor `Close` shows error so I'm willing to acknowledge defeat and close this issue. 

2. While focusing on failed case, I did not realize the RST is actually sent _every_ time. However, calling `shutdown` prior to close sometimes sends FIN prior to that and that makes test to pass but sometimes it does not and read fails. The randomness still somewhat sucks.

See attached capture for first and second case. 
[tls13-16.pcapng.zip](https://github.com/dotnet/runtime/files/5571439/tls13-16.pcapng.zip)

2.5 Aside from system call failures, we surface errors only by reading from socket. If we read specific amount of data, RST may or may not be visible as application error based on timing. 

3. Why TLS 1.3 matters? 
Same capture as previous point: As far as the client handshake is concerned, the handshake is done when packet 6 is processed e.g. client send hello and server respond back with 1341 bytes of data (server hello, cipher change and  4 records of "application data".  Since the CopyToAsync_AllDataCopied_Large test is unidirectional, we never read from the socket ever after. Packet 9 arrives and 478 will stay in socket buffer forever. Since "Cipher spec" everything is encrypted, I can only speculate here. As far as https://tools.ietf.org/html/rfc8446#page-73, this can be "New Session Ticket Message", "Post-Handshake Authentication" or "Key and Initialization Vector Update". The point is that the protocol can send messages after handshake without application writing actual data. CopyToAsync_AllDataCopied_Large fails to recognize that there can be additional chatter beyond application data written to the Stream. 

3a. Why TLS 1.2 works? 
[ssl17.pcap.zip](https://github.com/dotnet/runtime/files/5571685/ssl17.pcap.zip)
Session ticket comes in _before_ server's "cipher change" so it is read and processed as part of the TLS handshake before we go to the Decrypt path.

3b. Why #44741 actually worked?
My somewhat guess-answer was close to be correct. The streams are not quite equal and interchangeable. 
[ssl18.pcap.zip](https://github.com/dotnet/runtime/files/5571705/ssl18.pcap.zip)
Swapping the streams allows extra server message to be consumed avoiding the RST condition.


All the above will be avoided if both sides write _and_ read from the stream. That explains why HTTP works in practice. 
With all the above I think we should:
1. close this issue
2. move discussion to #44175 to figure out how to fix CopyToAsync_AllDataCopied_Large (and perhaps others)

**Comment by tmds** [comment]
> All the above will be avoided if both sides write and read from the stream. That explains why HTTP works in practice.
With all the above I think we should:

And for Kestrel specifically, I think it is continuously reading from the stream and putting the data in a Pipe.

Unless someone reports a product issue, I also think we shouldn't do anything and adjust the test expectations for SslStream.

**Comment by wfurt** [comment]
any thoughts why `shutdown` is not consistent @tmds?

**Comment by tmds** [comment]
> any thoughts why shutdown is not consistent @tmds?

Maybe it depends on whether there is still data in the send buffer. If there isn't, the shutdown will be tried immediately. If there is, the shutdown would be queued after sending the data. When a RST close happens, the unsent data and shutdown are ignored.
