### ISSUE TITLE
Ping_TimedOut_TAP|Sync_Success fails on MacOS

### ISSUE THREAD

**Issue by liveans** [dotnet/runtime#115358]
## Build Information
Build: https://dev.azure.com/dnceng-public/public/_build/results?buildId=1035079
Build error leg or test failing: System.Net.NetworkInformation.Tests.PingTest.Ping_TimedOut_Sync_Success

## Error Message

Fill the error message using [step by step known issues guidance](https://github.com/dotnet/arcade/blob/main/Documentation/Projects/Build%20Analysis/KnownIssueJsonStepByStep.md).

```json
{
  "ErrorPattern": "System\\.Net\\.NetworkInformation\\.Tests\\.PingTest\\.Ping_TimedOut_(TAP|Sync)_Success \\[FAIL\\]",
  "BuildRetry": false,
  "ExcludeConsoleLog": false
}
```

 ### Known issue validation
**Build: :mag_right:** https://dev.azure.com/dnceng-public/public/_build/results?buildId=1035079
**Error message validated:** `[System\.Net\.NetworkInformation\.Tests\.PingTest\.Ping_TimedOut_(TAP|Sync)_Success \[FAIL\]`]
**Result validation:** :white_check_mark: Known issue matched with the provided build.
**Validation performed at:** 5/7/2025 8:26:29 AM UTC

### Report

|Build|Definition|Test|Pull Request|
|---|---|---|---|
|[1064800](https://dev.azure.com/dnceng-public/public/_build/results?buildId=1064800)|dotnet/runtime|[System.Net.NetworkInformation.Tests.PingTest.Ping_TimedOut_Sync_Success](https://dev.azure.com/dnceng-public/public/_build/results?buildId=1064800&view=ms.vss-test-web.build-test-results-tab&runId=28770038&resultId=102302)||
|[1064803](https://dev.azure.com/dnceng-public/public/_build/results?buildId=1064803)|dotnet/runtime|[System.Net.NetworkInformation.Tests.PingTest.Ping_TimedOut_Sync_Success](https://dev.azure.com/dnceng-public/public/_build/results?buildId=1064803&view=ms.vss-test-web.build-test-results-tab&runId=28769906&resultId=102302)||
|[1063509](https://dev.azure.com/dnceng-public/public/_build/results?buildId=1063509)|dotnet/runtime|[System.Net.NetworkInformation.Tests.PingTest.Ping_TimedOut_Sync_Success](https://dev.azure.com/dnceng-public/public/_build/results?buildId=1063509&view=ms.vss-test-web.build-test-results-tab&runId=28722128&resultId=102911)||
|[1062372](https://dev.azure.com/dnceng-public/public/_build/results?buildId=1062372)|dotnet/runtime|[System.Net.NetworkInformation.Tests.PingTest.Ping_TimedOut_Sync_Success](https://dev.azure.com/dnceng-public/public/_build/results?buildId=1062372&view=ms.vss-test-web.build-test-results-tab&runId=28673702&resultId=102529)||
|[1061920](https://dev.azure.com/dnceng-public/public/_build/results?buildId=1061920)|dotnet/runtime|[System.Net.NetworkInformation.Tests.PingTest.Ping_TimedOut_Sync_Success](https://dev.azure.com/dnceng-public/public/_build/results?buildId=1061920&view=ms.vss-test-web.build-test-results-tab&runId=28659464&resultId=102911)||
|[1061632](https://dev.azure.com/dnceng-public/public/_build/results?buildId=1061632)|dotnet/runtime|[System.Net.NetworkInformation.Tests.PingTest.Ping_TimedOut_Sync_Success](https://dev.azure.com/dnceng-public/public/_build/results?buildId=1061632&view=ms.vss-test-web.build-test-results-tab&runId=28646630&resultId=102233)||
|[1060886](https://dev.azure.com/dnceng-public/public/_build/results?buildId=1060886)|dotnet/runtime|[System.Net.NetworkInformation.Tests.PingTest.Ping_TimedOut_Sync_Success](https://dev.azure.com/dnceng-public/public/_build/results?buildId=1060886&view=ms.vss-test-web.build-test-results-tab&runId=28624472&resultId=102368)||
|[1059893](https://dev.azure.com/dnceng-public/public/_build/results?buildId=1059893)|dotnet/runtime|[System.Net.NetworkInformation.Tests.PingTest.Ping_TimedOut_Sync_Success](https://dev.azure.com/dnceng-public/public/_build/results?buildId=1059893&view=ms.vss-test-web.build-test-results-tab&runId=28593778&resultId=102529)||
|[1058725](https://dev.azure.com/dnceng-public/public/_build/results?buildId=1058725)|dotnet/runtime|[System.Net.NetworkInformation.Tests.PingTest.Ping_TimedOut_Sync_Success](https://dev.azure.com/dnceng-public/public/_build/results?buildId=1058725&view=ms.vss-test-web.build-test-results-tab&runId=28554668&resultId=102466)||
|[1057797](https://dev.azure.com/dnceng-public/public/_build/results?buildId=1057797)|dotnet/runtime|[System.Net.NetworkInformation.Tests.PingTest.Ping_TimedOut_Sync_Success](https://dev.azure.com/dnceng-public/public/_build/results?buildId=1057797&view=ms.vss-test-web.build-test-results-tab&runId=28522332&resultId=102199)||
|[1057777](https://dev.azure.com/dnceng-public/public/_build/results?buildId=1057777)|dotnet/runtime|[System.Net.NetworkInformation.Tests.PingTest.Ping_TimedOut_Sync_Success](https://dev.azure.com/dnceng-public/public/_build/results?buildId=1057777&view=ms.vss-test-web.build-test-results-tab&runId=28522142&resultId=102212)|dotnet/runtime#109648|
|[1056733](https://dev.azure.com/dnceng-public/public/_build/results?buildId=1056733)|dotnet/runtime|[System.Net.NetworkInformation.Tests.PingTest.Ping_TimedOut_Sync_Success](https://dev.azure.com/dnceng-public/public/_build/results?buildId=1056733&view=ms.vss-test-web.build-test-results-tab&runId=28486224&resultId=102354)||
|[1056135](https://dev.azure.com/dnceng-public/public/_build/results?buildId=1056135)|dotnet/runtime|[System.Net.NetworkInformation.Tests.PingTest.Ping_TimedOut_Sync_Success](https://dev.azure.com/dnceng-public/public/_build/results?buildId=1056135&view=ms.vss-test-web.build-test-results-tab&runId=28466660&resultId=102314)||
|[1055707](https://dev.azure.com/dnceng-public/public/_build/results?buildId=1055707)|dotnet/runtime|[System.Net.NetworkInformation.Tests.PingTest.Ping_TimedOut_Sync_Success](https://dev.azure.com/dnceng-public/public/_build/results?buildId=1055707&view=ms.vss-test-web.build-test-results-tab&runId=28453788&resultId=102199)||
|[1055002](https://dev.azure.com/dnceng-public/public/_build/results?buildId=1055002)|dotnet/runtime|[System.Net.NetworkInformation.Tests.PingTest.Ping_TimedOut_Sync_Success](https://dev.azure.com/dnceng-public/public/_build/results?buildId=1055002&view=ms.vss-test-web.build-test-results-tab&runId=28432732&resultId=102208)||
|[1053976](https://dev.azure.com/dnceng-public/public/_build/results?buildId=1053976)|dotnet/runtime|[System.Net.NetworkInformation.Tests.PingTest.Ping_TimedOut_Sync_Success](https://dev.azure.com/dnceng-public/public/_build/results?buildId=1053976&view=ms.vss-test-web.build-test-results-tab&runId=28403626&resultId=102208)||
|[1051856](https://dev.azure.com/dnceng-public/public/_build/results?buildId=1051856)|dotnet/runtime|[System.Net.NetworkInformation.Tests.PingTest.Ping_TimedOut_Sync_Success](https://dev.azure.com/dnceng-public/public/_build/results?buildId=1051856&view=ms.vss-test-web.build-test-results-tab&runId=28348134&resultId=102196)||
|[1051224](https://dev.azure.com/dnceng-public/public/_build/results?buildId=1051224)|dotnet/runtime|[System.Net.NetworkInformation.Tests.PingTest.Ping_TimedOut_Sync_Success](https://dev.azure.com/dnceng-public/public/_build/results?buildId=1051224&view=ms.vss-test-web.build-test-results-tab&runId=28326584&resultId=102211)||
|[1050633](https://dev.azure.com/dnceng-public/public/_build/results?buildId=1050633)|dotnet/runtime|[System.Net.NetworkInformation.Tests.PingTest.Ping_TimedOut_Sync_Success](https://dev.azure.com/dnceng-public/public/_build/results?buildId=1050633&view=ms.vss-test-web.build-test-results-tab&runId=28309668&resultId=102911)||
|[1050347](https://dev.azure.com/dnceng-public/public/_build/results?buildId=1050347)|dotnet/runtime|[System.Net.NetworkInformation.Tests.PingTest.Ping_TimedOut_Sync_Success](https://dev.azure.com/dnceng-public/public/_build/results?buildId=1050347&view=ms.vss-test-web.build-test-results-tab&runId=28299918&resultId=102199)||
|[1049549](https://dev.azure.com/dnceng-public/public/_build/results?buildId=1049549)|dotnet/runtime|[System.Net.NetworkInformation.Tests.PingTest.Ping_TimedOut_Sync_Success](https://dev.azure.com/dnceng-public/public/_build/results?buildId=1049549&view=ms.vss-test-web.build-test-results-tab&runId=28278498&resultId=102449)||
|[1048541](https://dev.azure.com/dnceng-public/public/_build/results?buildId=1048541)|dotnet/runtime|[System.Net.NetworkInformation.Tests.PingTest.Ping_TimedOut_Sync_Success](https://dev.azure.com/dnceng-public/public/_build/results?buildId=1048541&view=ms.vss-test-web.build-test-results-tab&runId=28252446&resultId=102368)||
|[1047453](https://dev.azure.com/dnceng-public/public/_build/results?buildId=1047453)|dotnet/runtime|[System.Net.NetworkInformation.Tests.PingTest.Ping_TimedOut_Sync_Success](https://dev.azure.com/dnceng-public/public/_build/results?buildId=1047453&view=ms.vss-test-web.build-test-results-tab&runId=28221936&resultId=102211)||
|[1047452](https://dev.azure.com/dnceng-public/public/_build/results?buildId=1047452)|dotnet/runtime|[System.Net.NetworkInformation.Tests.PingTest.Ping_TimedOut_Sync_Success](https://dev.azure.com/dnceng-public/public/_build/results?buildId=1047452&view=ms.vss-test-web.build-test-results-tab&runId=28221822&resultId=102211)||
|[1046313](https://dev.azure.com/dnceng-public/public/_build/results?buildId=1046313)|dotnet/runtime|[System.Net.NetworkInformation.Tests.PingTest.Ping_TimedOut_Sync_Success](https://dev.azure.com/dnceng-public/public/_build/results?buildId=1046313&view=ms.vss-test-web.build-test-results-tab&runId=28178632&resultId=102236)||
|[1046299](https://dev.azure.com/dnceng-public/public/_build/results?buildId=1046299)|dotnet/runtime|[System.Net.NetworkInformation.Tests.PingTest.Ping_TimedOut_Sync_Success](https://dev.azure.com/dnceng-public/public/_build/results?buildId=1046299&view=ms.vss-test-web.build-test-results-tab&runId=28176296&resultId=102208)||
|[1045060](https://dev.azure.com/dnceng-public/public/_build/results?buildId=1045060)|dotnet/runtime|[System.Net.NetworkInformation.Tests.PingTest.Ping_TimedOut_Sync_Success](https://dev.azure.com/dnceng-public/public/_build/results?buildId=1045060&view=ms.vss-test-web.build-test-results-tab&runId=28128594&resultId=102525)||
|[1045064](https://dev.azure.com/dnceng-public/public/_build/results?buildId=1045064)|dotnet/runtime|[System.Net.NetworkInformation.Tests.PingTest.Ping_TimedOut_Sync_Success](https://dev.azure.com/dnceng-public/public/_build/results?buildId=1045064&view=ms.vss-test-web.build-test-results-tab&runId=28128382&resultId=102525)||
|[1044304](https://dev.azure.com/dnceng-public/public/_build/results?buildId=1044304)|dotnet/runtime|[System.Net.NetworkInformation.Tests.PingTest.Ping_TimedOut_Sync_Success](https://dev.azure.com/dnceng-public/public/_build/results?buildId=1044304&view=ms.vss-test-web.build-test-results-tab&runId=28101060&resultId=102199)||
|[1044297](https://dev.azure.com/dnceng-public/public/_build/results?buildId=1044297)|dotnet/runtime|[System.Net.NetworkInformation.Tests.PingTest.Ping_TimedOut_Sync_Success](https://dev.azure.com/dnceng-public/public/_build/results?buildId=1044297&view=ms.vss-test-web.build-test-results-tab&runId=28100898&resultId=102302)||
|[1043483](https://dev.azure.com/dnceng-public/public/_build/results?buildId=1043483)|dotnet/runtime|[System.Net.NetworkInformation.Tests.PingTest.Ping_TimedOut_Sync_Success](https://dev.azure.com/dnceng-public/public/_build/results?buildId=1043483&view=ms.vss-test-web.build-test-results-tab&runId=28074648&resultId=102420)||
|[1043487](https://dev.azure.com/dnceng-public/public/_build/results?buildId=1043487)|dotnet/runtime|[System.Net.NetworkInformation.Tests.PingTest.Ping_TimedOut_Sync_Success](https://dev.azure.com/dnceng-public/public/_build/results?buildId=1043487&view=ms.vss-test-web.build-test-results-tab&runId=28074378&resultId=102245)||
|[1042446](https://dev.azure.com/dnceng-public/public/_build/results?buildId=1042446)|dotnet/runtime|[System.Net.NetworkInformation.Tests.PingTest.Ping_TimedOut_Sync_Success](https://dev.azure.com/dnceng-public/public/_build/results?buildId=1042446&view=ms.vss-test-web.build-test-results-tab&runId=28041698&resultId=102314)||
|[1042447](https://dev.azure.com/dnceng-public/public/_build/results?buildId=1042447)|dotnet/runtime|[System.Net.NetworkInformation.Tests.PingTest.Ping_TimedOut_Sync_Success](https://dev.azure.com/dnceng-public/public/_build/results?buildId=1042447&view=ms.vss-test-web.build-test-results-tab&runId=28041644&resultId=102476)||
|[1041302](https://dev.azure.com/dnceng-public/public/_build/results?buildId=1041302)|dotnet/runtime|[System.Net.NetworkInformation.Tests.PingTest.Ping_TimedOut_Sync_Success](https://dev.azure.com/dnceng-public/public/_build/results?buildId=1041302&view=ms.vss-test-web.build-test-results-tab&runId=28008660&resultId=102366)||
|[1041301](https://dev.azure.com/dnceng-public/public/_build/results?buildId=1041301)|dotnet/runtime|[System.Net.NetworkInformation.Tests.PingTest.Ping_TimedOut_Sync_Success](https://dev.azure.com/dnceng-public/public/_build/results?buildId=1041301&view=ms.vss-test-web.build-test-results-tab&runId=28008540&resultId=102248)||
|[1040401](https://dev.azure.com/dnceng-public/public/_build/results?buildId=1040401)|dotnet/runtime|[System.Net.NetworkInformation.Tests.PingTest.Ping_TimedOut_Sync_Success](https://dev.azure.com/dnceng-public/public/_build/results?buildId=1040401&view=ms.vss-test-web.build-test-results-tab&runId=27984608&resultId=102911)||
|[1040400](https://dev.azure.com/dnceng-public/public/_build/results?buildId=1040400)|dotnet/runtime|[System.Net.NetworkInformation.Tests.PingTest.Ping_TimedOut_Sync_Success](https://dev.azure.com/dnceng-public/public/_build/results?buildId=1040400&view=ms.vss-test-web.build-test-results-tab&runId=27984606&resultId=102368)||
#### Summary
|24-Hour Hit Count|7-Day Hit Count|1-Month Count|
|---|---|---|
|2|8|38|

**Comment by wfurt** [comment]
I did get login on the particular machine and OS ping works as expected. 
```
helix-runner@dci-mac-build-053 ~ % ping 192.0.2.0
PING 192.0.2.0 (192.0.2.0): 56 data bytes
Request timeout for icmp_seq 0
Request timeout for icmp_seq 1
Request timeout for icmp_seq 2
``` 


this may be transient error and perhaps we shall just swallow the exception. Or pass the test as long as the Ping does not succeed

**Comment by liveans** [comment]
What I'm curious about is that: if ping tool is also swallowing DestinationUnreachable as TimedOut as well, because according to ping's nature it's practically same, and if that's the case should we do it in product code instead?

**Comment by wfurt** [comment]
IU don't see any responses on that machine when running OS ping  .... as it should.
```
helix-runner@dci-mac-build-053 ~ % sudo tcpdump -i en0 icmp
tcpdump: verbose output suppressed, use -v or -vv for full protocol decode
listening on en0, link-type EN10MB (Ethernet), capture size 262144 bytes
13:00:25.151521 IP 10.240.144.28 > 192.0.2.0: ICMP echo request, id 46708, seq 0, length 64
13:00:26.161657 IP 10.240.144.28 > 192.0.2.0: ICMP echo request, id 46708, seq 1, length 64
13:00:27.163837 IP 10.240.144.28 > 192.0.2.0: ICMP echo request, id 46708, seq 2, length 64
13:00:28.165994 IP 10.240.144.28 > 192.0.2.0: ICMP echo request, id 46708, seq 3, length 64
13:00:29.170474 IP 10.240.144.28 > 192.0.2.0: ICMP echo request, id 46708, seq 4, length 64
13:00:30.172687 IP 10.240.144.28 > 192.0.2.0: ICMP echo request, id 46708, seq 5, length 64
```
