### ISSUE TITLE
ClientWebSocket ignores ContentType Option

### ISSUE THREAD

**Issue by ptsneves** [dotnet/runtime#1035]
Hello all,
I would like to raise the issue that in .net runtime in core 2.2 for Linux the content type header setting is ignored silently (no exception). 
I confirmed this with Wireshark:

```
Frame 550: 255 bytes on wire (2040 bits), 255 bytes captured (2040 bits) on interface 0
Ethernet II, Src: 00:00:00_00:00:00 (00:00:00:00:00:00), Dst: 00:00:00_00:00:00 (00:00:00:00:00:00)
Internet Protocol Version 4, Src: 127.0.0.1, Dst: 127.0.0.1
Transmission Control Protocol, Src Port: 38887, Dst Port: 5000, Seq: 1, Ack: 1, Len: 189
Hypertext Transfer Protocol
    GET /ws HTTP/1.1\r\n
        [Expert Info (Chat/Sequence): GET /ws HTTP/1.1\r\n]
        Request Method: GET
        Request URI: /ws
        Request Version: HTTP/1.1
    x-device-expected-serial: 000000\r\n
    Connection: Upgrade\r\n
    Upgrade: websocket\r\n
    Sec-WebSocket-Version: 13\r\n
    Sec-WebSocket-Key: hU/ERkNBJESfWATOPk/Y5w==\r\n
    Host: localhost:5000\r\n
    \r\n
    [Full request URI: http://localhost:5000/ws]
    [HTTP request 1/1]
    [Response in frame: 552]
```

As you can see my custom header  x-device-expected-serial is allowed to go through but the ContentType is not:

```
ws_transport.WebSocketOptions.SetRequestHeader("Content-Type", "application/x-thrift");
ws_transport.WebSocketOptions.SetRequestHeader("x-device-expected-serial", serial_field);
```

Right now this is blocking my integration tests as my middleware correctly blocks no x-thrift content on it's endpoint. Other application in other languages have no issue in me setting this header and they work. Why the opinion on on what constitutes a restricted header at all?

**Comment by davidsh** [comment]
>Right now this is blocking my integration tests as my middleware correctly blocks no x-thrift content on it's endpoint.

@ptsneves Why does your WebSocket endpoint care about the 'Content-Type' header in the HTTP GET request? The GET request is not posting any request body content. The GET request used for ClientWebSocket is simply a way for the websocket handshake to start. After the websocket is established, HTTP protocol is no longer used and WebSocket protocol is used.

**Comment by ptsneves** [comment]
Hello @davidsh the goal is exactly for handshake purposes. The endpoint should only be used for this content type and I want the Middleware to reject the connection immediately if the content type is incorrect. The http GET verb is kind of irrelevant for web sockets anyway as HTTP becomes just a transport on which the web socket session will run. So to sum up, I would like to not even start a web socket session if the http content type header is not the one expected. Otherwise I have an expensive operation to validate the content of the web socket session. I can also use a different custom header for this purpose but I believed this would not be the proper way to express the endpoint capabilities in a standard way.

**Comment by davidsh** [comment]
@ptsneves Thank you for explaining your use case.

The HTTP RFC doesn't disallow those headers for a GET request even if the request body payload is 0 bytes. So, I agree with you that this scenario should work.

It currently doesn't work due to how we store headers. Those particular headers such as 'Content-Type' are stored in an HttpRequestMessage.Content.Headers collection only. But since there is no content being sent, the .Content object is null and that header is ignored and stored into the HttpRequestMessage when the websocket handshakes starts. However, we could probably fix this by creating a .Content object consisting of 0 bytes payload length. This would allow those particular headers to be stored and thus sent.

@stephentoub

**Comment by karelz** [comment]
Triage: Reasonable request, probably with low priority (given the low interest).
We should make it pay for play in terms of allocaitons.
